,subreddit,title,sentiment,upvote_ratio,ups,downs,score
0,Ask_Politics,Rules Update - Increased sourcing requirements,positive,0.9,7,0,7
1,Ask_Politics,"Just curious, are people with total or near total hearing loss more or less likely to vote for DT in the next election? ",negative,0.73,7,0,7
2,Ask_Politics,How is society's political ideology defined?,positive,1.0,8,0,8
3,Ask_Politics,Help me understand how Kamela Harris' policies might play out.,positive,0.39,0,0,0
4,Ask_Politics,"How is politics not a ""solved"" science at this point?",positive,0.72,10,0,10
5,Ask_Politics,Why left wings in EU support always Palestine but forget other oppressed people ?,negative,0.3,0,0,0
6,Ask_Politics,Why does Donald Trump want the boarders closed?,negative,0.81,3,0,3
7,Ask_Politics,"Why do right wing candidates tend to win more voters based on culture war issues, than left wing candidates?",positive,1.0,2,0,2
8,Ask_Politics,Has Trump had a permanent mark on politics or is this just temporarly?,negative,1.0,1,0,1
9,Ask_Politics,Is international law actually taken seriously?,negative,0.91,9,0,9
10,Ask_Politics,"Why do people often want the law to disincentivize bad behavior, instead using the law incentivize good behavior?",positive,0.8,18,0,18
11,Ask_Politics,"If trump loses, can he run again in four yrs?",positive,0.88,32,0,32
12,Ask_Politics,What is the big fight over the SAVE Act all about?,negative,0.73,11,0,11
13,Ask_Politics,Why does the global Left not condemn Arab/Islamic imperialism?,positive,0.59,5,0,5
14,Ask_Politics,Am I right to be worried about the Ukraine War?,positive,0.36,0,0,0
15,Ask_Politics,Has an entire city council plus the mayor ever been recalled all at once before?,positive,1.0,1,0,1
16,Ask_Politics,How has the far right developed in post-Soviet countries since the fall of the USSR?,positive,1.0,1,0,1
17,Ask_Politics,One thing I don't understand about the Bush administration's decisions is why they would empower the Shiite majority in Iraq instead of the Sunnis during the U.S. invasion of Iraq,negative,0.82,10,0,10
18,Ask_Politics,Why do the US parties project such confidence in the run-up to (presidential?) elections?  ,positive,1.0,1,0,1
19,Ask_Politics,Should this new era be considered a new Cold War or an extension of the old one,negative,1.0,1,0,1
20,Ask_Politics,Why does it matter which side of the screen the candidates appear on during debates?,positive,0.96,35,0,35
21,Ask_Politics,"Putin Endorsed Harris, Will This Be A Trump Talking Point For Republicans, and Trump",positive,0.32,0,0,0
22,Ask_Politics,What key congressional races are key for control of the US Senate and House?,negative,0.72,3,0,3
23,Ask_Politics,"Books about organization, movements, collectives and occupations in Greece?",positive,1.0,6,0,6
24,Ask_Politics,Voting system where each party gets votes instead of candidates?,positive,1.0,2,0,2
25,Ask_Politics,Why get rid of the Department of Education? ,neutral,0.93,34,0,34
